{
  "$schema": "https://json-schema.org/draft/2020-12/schema",
  "$id": "https://aleph.local/schemas/2.0/run-ledger.schema.json",
  "type": "object",
  "additionalProperties": false,
  "required": [
    "schema_version",
    "run_contract_version",
    "mode",
    "ticks",
    "model_hash",
    "config",
    "config_hash",
    "result_hash",
    "result",
    "trace_contract",
    "trace_execution_binding",
    "contract_hash"
  ],
  "properties": {
    "schema_version": {"const": "2.0.0"},
    "run_contract_version": {"const": "aleph-run-2.0"},
    "mode": {"enum": ["deterministic", "monte_carlo"]},
    "ticks": {"type": "integer", "minimum": 0},
    "model_hash": {"type": "string", "pattern": "^[0-9a-f]{64}$"},
    "config": {"type": "object"},
    "config_hash": {"type": "string", "pattern": "^[0-9a-f]{64}$"},
    "result_hash": {"type": "string", "pattern": "^[0-9a-f]{64}$"},
    "result": {"type": "object"},
    "trace_contract": {
      "type": "object",
      "additionalProperties": false,
      "required": ["path", "sha256", "row_count"],
      "properties": {
        "path": {"type": "string", "minLength": 1},
        "sha256": {"type": "string", "pattern": "^[0-9a-f]{64}$"},
        "row_count": {"type": "integer", "minimum": 1}
      }
    },
    "trace_execution_binding": {
      "type": "object",
      "additionalProperties": false,
      "required": ["version", "mode", "ticks", "rows", "binding_hash"],
      "properties": {
        "version": {"const": "aleph-trace-execution-binding-v1"},
        "mode": {"enum": ["deterministic", "monte_carlo"]},
        "ticks": {"type": "integer", "minimum": 0},
        "rows": {
          "type": "array",
          "minItems": 1,
          "items": {
            "type": "object",
            "additionalProperties": false,
            "required": ["step", "edge_id", "run_id", "tick", "source_tick", "source_state", "target_state", "sampled_strength", "run_hash", "history_hash"],
            "properties": {
              "step": {"type": "integer", "minimum": 1},
              "edge_id": {"type": "string", "pattern": "^(causal|edge):"},
              "run_id": {"type": "integer", "minimum": 0},
              "tick": {"type": "integer", "minimum": 0},
              "source_tick": {"type": "integer", "minimum": 0},
              "source_state": {"type": "number"},
              "target_state": {"type": "number"},
              "sampled_strength": {"type": "number"},
              "run_hash": {"type": "string", "pattern": "^[0-9a-f]{64}$"},
              "history_hash": {"type": "string", "pattern": "^[0-9a-f]{64}$"}
            }
          }
        },
        "binding_hash": {"type": "string", "pattern": "^[0-9a-f]{64}$"}
      }
    },
    "contract_hash": {"type": "string", "pattern": "^[0-9a-f]{64}$"}
  }
}
